TIPO_ELECCION;AÑO;MES;COD_CAND;SIGLAS_CAND;DENOM_CAND;COD_NPROV;COD_NAUT;COD_NNAC
4;2015;5;198;AGRUPACION;AGRUPACION DE ELECTORES EL VISO SI PUEDE;198;198;198
4;2015;5;199;AGRUPACION;AGRUPACION DE ELECTORES EN MOVIMIENTO VALVERDE DE;199;199;199
4;2015;5;200;Errenteria;AGRUPACION DE ELECTORES ERRENTERIA IRABAZIZ;200;200;200
4;2015;5;201;G.H.E;"AGRUPACIÓN DE ELECTORES ""GABIRIA""";201;201;201
4;2015;5;202;GANA LANTEI;AGRUPACIÓN DE ELECTORES GANA LANTEIRA;202;202;202
4;2015;5;203;A.d.E.G.A.S;AGRUPACION DE ELECTORES GANEMOS ALPUJARRA DE LA SI;203;203;203
4;2015;5;204;G.J.;AGRUPACION DE ELECTORES GANEMOS JEREZ;204;204;204
4;2015;5;205;AdE GL;AGRUPACION DE ELECTORES GANEMOS LANJARON;205;205;205
4;2015;5;206;AdE GO;AGRUPACION DE ELECTORES GANEMOS ORGIVA;206;206;206
4;2015;5;207;GANEMOS SAL;AGRUPACION DE ELECTORES GANEMOS SALAMANCA;207;207;207
4;2015;5;208;A.E.G.T;AGRUPACION DE ELECTORES GANEMOS TORVIZCON;208;208;208
4;2015;5;209;GDZ;AGRUPACION DE ELECTORES: GENTE DE ZUJAR;209;209;209
4;2015;5;211;G.I.G.;AGRUPACION DE ELECTORES GRUPO INDEPENDIENTE DE GAL;211;211;211
4;2015;5;212;GIPR;"AGRUPACIÓN DE ELECTORES ""GRUPO INDEPENDIENTE POR P";212;212;212
4;2015;5;213;G.R.;AGRUPACIÓN DE ELECTORES GUANYEM ROCAFORT;213;213;213
4;2015;5;214;A.E.G.;AGRUPACIÓN DE ELECTORES GUATIZALEMA;214;214;214
4;2015;5;215;HSI;AGRUPACION DE ELECTORES HIGUERA INDEPENDIENTE;215;215;215
4;2015;5;216;HC;AGRUPACIÓN DE ELECTORES HUENEJA CAMBIA;216;216;216
4;2015;5;217;ILLESCAS SI;AGRUPACION DE ELECTORES ILLESCAS SI PUEDE;217;217;217
4;2015;5;218;A.E.I.C.C.;AGRUPACIÓN DE ELECTORES INDEPENDIENTE COMUNIDAD CI;218;218;218
4;2015;5;219;AGRUPACION;AGRUPACION DE ELECTORES INDEPENDIENTE CREMENES;219;219;219
4;2015;5;220;IA;AGRUPACION DE ELECTORES INDEPENDIENTE DE ALGADEFE;220;220;220
4;2015;5;221;A.E.I.C.;AGRUPACION DE ELECTORES INDEPENDIENTE DE CARDIEL;221;221;221
4;2015;5;222;AGRUPACION;AGRUPACION DE ELECTORES INDEPENDIENTE DE CIMANES D;222;222;222
4;2015;5;223;AIC;AGRUPACION DE ELECTORES INDEPENDIENTE DE CUADROS;223;223;223
4;2015;5;224;AGRUPACION;AGRUPACION DE ELECTORES INDEPENDIENTE DE GALINDO Y;224;224;224
4;2015;5;225;AEIG;AGRUPACIÓN DE ELECTORES INDEPENDIENTE DE GORAFE;225;225;225
4;2015;5;226;A.E.I.R.C;AGRUPACION DE ELECTORES INDEPENDIENTE DE ROBLEDO D;226;226;226
4;2015;5;227;A.I.R.;AGRUPACION DE ELECTORES INDEPENDIENTE DE RUIDERA;227;227;227
4;2015;5;228;A.E.I.S.;AGRUPACION DE ELECTORES INDEPENDIENTE DE SAÚCA;228;228;228
4;2015;5;229;ADEI;AGRUPACION DE ELECTORES INDEPENDIENTE DE VALDERRUE;229;229;229
4;2015;5;231;AGRUPACION;AGRUPACION DE ELECTORES INDEPENDIENTE RIO ESLA;231;231;231
4;2015;5;232;AGRUPACION;AGRUPACION DE ELECTORES INDEPENDIENTES;232;232;232
4;2015;5;234;IdeA;Agrupación de electores Independientes de Abla;234;234;234
4;2015;5;235;I.D.A.R.;AGRUPACION DE ELECTORES INDEPENDIENTES DE ALAGON D;235;235;235
4;2015;5;236;AEIAM;AGRUPACIÓN DE ELECTORES INDEPENDIENTES DE ALGAR DE;236;236;236
4;2015;5;237;A.E.I.A.;AGRUPACION DE ELECTORES INDEPENDIENTES DE ALMANSA;237;237;237
4;2015;5;238;AGRUPACION;AGRUPACION DE ELECTORES INDEPENDIENTES DE ALMONAST;238;238;238
4;2015;5;239;A.D.EC.I.A.;AGRUPACION DE ELECTORES INDEPENDIENTES DE AUÑON;239;239;239
4;2015;5;240;IxR;AGRUPACION DE ELECTORES INDEPENDIENTES DE LAS REGU;240;240;240
4;2015;5;241;AEPILS;AGRUPACION DE ELECTORES INDEPENDIENTES DE LINARES;241;241;241
4;2015;5;242;A.E.I.O;AGRUPACION DE ELECTORES INDEPENDIENTES DE ONTIGOLA;242;242;242
4;2015;5;243;AGRUPACION;AGRUPACION DE ELECTORES INDEPENDIENTES DE RIBEROS;243;243;243
4;2015;5;244;IdR;AGRUPACION DE ELECTORES INDEPENDIENTES DE RODEIRO;244;244;244
4;2015;5;245;AEIV;AGRUPACION DE ELECTORES INDEPENDIENTES DE VILLASEL;245;245;245
4;2015;5;246;AEIA;AGRUPACION DE ELECTORES INDEPENDIENTES POR ALFACAR;246;246;246
4;2015;5;247;A.E.I. POR;AGRUPACION DE ELECTORES INDEPENDIENTES POR LA DIGN;247;247;247
4;2015;5;248;A.E.I.M.;AGRUPACION DE ELECTORES INDEPENDIENTES POR LA MALA;248;248;248
4;2015;5;249;AIMA;AGRUPACION DE ELECTORES INDEPENDIENTES POR LOS MAR;249;249;249
4;2015;5;250;I.P.M.;AGRUPACION DE ELECTORES INDEPENDIENTES POR MOLINA;250;250;250
4;2015;5;251;IPV;AGRUPACION DE ELECTORES INDEPENDIENTES POR VALDELA;251;251;251
4;2015;5;252;A.E.I.V.;AGRUPACION DE ELECTORES INDEPENDIENTES POR VILLANU;252;252;252
4;2015;5;253;ADEIZA;AGRUPACION DE ELECTORES INDEPENDIENTES ZAMORANOS;253;253;253
4;2015;5;255;IMAGINES;AGRUPACION DE ELECTORES INICIATIVA MUNICIPALISTA Y;255;255;255
4;2015;5;257;JeC;AGRUPACION DE ELECTORES JAEN EN COMUN;257;257;257
4;2015;5;258;JOBEN;AGRUPACION DE ELECTORES JOBEN;258;258;258
4;2015;5;259;AGRUPACION;"AGRUPACION DE ELECTORES ""JOVENES POR HONTORIA""";259;259;259
4;2015;5;260;AEJP;AGRUPACION DE ELECTORES JUMILLA PUEDE;260;260;260
4;2015;5;261;J.S.;AGRUPACIÓN DE ELECTORES JUNTOS SUMAMOS;261;261;261
4;2015;5;262;KAIXO;AGRUPACIÓN DE ELECTORES KAIXO;262;262;262
4;2015;5;263;LA ENCINA;AGRUPACION DE ELECTORES LA ENCINA DE TALAVERA LA R;263;263;263
4;2015;5;264;LSSP;AGRUPACION DE ELECTORES LAGUNA SÍ SE PUEDE;264;264;264
4;2015;5;265;AET;AGRUPACION DE ELECTORES LAS TEJERUELAS;265;265;265
4;2015;5;266;AGRUPACION;AGRUPACION DE ELECTORES LEON DESPIERTA;266;266;266
4;2015;5;267;LIAVI;AGRUPACION DE ELECTORES LISTA ABIERTA POR VILLAMEN;267;267;267
4;2015;5;268;LIZARRI;"AGRUPACION DE ELECTORES ""LIZARRI HERRI KANDIDATURA";268;268;268
4;2015;5;269;AGRUPACION;AGRUPACION DE ELECTORES LLERENA PUEDE;269;269;269
4;2015;5;270;LLIRIA PUED;AGRUPACION DE ELECTORES LLIRIA PUEDE;270;270;270
4;2015;5;271;AGRUPACIÓN;"AGRUPACIÓN DE ELECTORES ""LOS BARRIOS SI SE PUEDE""";271;271;271
4;2015;5;272;AEMP;AGRUPACION DE ELECTORES MARUGAN PINAR;272;272;272
4;2015;5;273;MI;AGRUPACION DE ELECTORES MEAÑO INDEPENDIENTE;273;273;273
4;2015;5;274;MdC;AGRUPACION DE ELECTORES MESA DE CONVERGENCIA;274;274;274
4;2015;5;275;MSM;AGRUPACION DE ELECTORES MOLINA SE MUEVE;275;275;275
4;2015;5;276;M2015;AGRUPACION DE ELECTORES MONTAN 2015;276;276;276
4;2015;5;277;AE-MdR;AGRUPACION DE ELECTORES MONTE DE LA RAD;277;277;277
4;2015;5;278;M.A.S.;AGRUPACION DE ELECTORES MONTURQUE, AVANCE SEGURO;278;278;278
4;2015;5;279;AE NAVARIDA;AGRUPACIÓN DE ELECTORES NAVARIDAS;279;279;279
4;2015;5;280;NC;"AGRUPACION DE ELECTORES ""NUEVO CASTRIL""";280;280;280
4;2015;5;281;AGRUPACION;AGRUPACION DE ELECTORES OTRO AIRE;281;281;281
4;2015;5;282;AGRUPACIÓN;AGRUPACIÓN DE ELECTORES PARTICIPANDO EN BARAÑAIN/B;282;282;282
4;2015;5;283;PIB;AGRUPACIÓN DE ELECTORES PIB;283;283;283
4;2015;5;284;PA;AGRUPACION DE ELECTORES PIORNAL AHORA;284;284;284
4;2015;5;285;APAC;AGRUPACION DE ELECTORES PLATAFORMA ABERTA CIDADA D;285;285;285
4;2015;5;286;POR ALDEIRE;AGRUPACIÓN DE ELECTORES POR ALDEIRE;286;286;286
4;2015;5;287;XB;AGRUPACION DE ELECTORES POR BONICHES;287;287;287
4;2015;5;288;P.C.S.S.P.;"AGRUPACIÓN DE ELECTORES ""POR CHICLANA SI SE PUEDE""";288;288;288
4;2015;5;289;POR FRESNED;"AGRUPACIÓN DE ELECTORES ""POR FRESNEDILLAS""";289;289;289
4;2015;5;290;SSP;AGRUPACION DE ELECTORES POR PATERNA DEL CAMPO, SI;290;290;290
4;2015;5;291;AET;AGRUPACION DE ELECTORES POR TEJEDA;291;291;291
4;2015;5;292;PVB;AGRUPACION DE ELECTORES POR VELEZ BLANCO;292;292;292
4;2015;5;293;"A.D.E."" POR";"AGRUPACION DE ELECTORES ""POR VILLANUEVA""";293;293;293
4;2015;5;294;AEPZ;AGRUPACION DE ELECTORES POR ZARRA;294;294;294
4;2015;5;295;AGRUPACION;AGRUPACION DE ELECTORES PUEBLO DE FRANDOVINEZ;295;295;295
4;2015;5;296;AGRUPACIÓN;AGRUPACIÓN DE ELECTORES PUEBLO DE LEZAKO HERRIA;296;296;296
4;2015;5;297;PUES;AGRUPACION DE ELECTORES PUEBLO.ES;297;297;297
4;2015;5;298;QHQ;AGRUPACION DE ELECTORES QUE HERVAS QUIERES;298;298;298
4;2015;5;305;AER;AGRUPACION DE ELECTORES REDONDELA 2015;305;305;305
4;2015;5;306;AGRUPACION;AGRUPACION DE ELECTORES RIBEIRO EN COMUN;306;306;306
4;2015;5;307;RA;AGRUPACION DE ELECTORES ROQUE AGUAYRO;307;307;307
4;2015;5;308;ADES;AGRUPACION DE ELECTORES SALVATERRA;308;308;308
4;2015;5;309;SED;AGRUPACION DE ELECTORES SAN ESTEBAN DE DEIO;309;309;309
4;2015;5;310;AGRUPACION;AGRUPACION DE ELECTORES SAN JUAN DE PLAN;310;310;310
4;2015;5;313;SARRAGOA;AGRUPACIÓN DE ELECTORES SARRAGOA;313;313;313
4;2015;5;314;S.I.;"AGRUPACIÓN DE ELECTORES ""SAX IMPORTA""";314;314;314
4;2015;5;315;SE PUEDE;AGRUPACION DE ELECTORES SE PUEDE;315;315;315
4;2015;5;316;SERRADILLAN;AGRUPACION DE ELECTORES SERRADILLANOS;316;316;316
4;2015;5;317;SÍ SE PUEDE;AGRUPACIÓN DE ELECTORES SÍ SE PUEDE ARANDA;317;317;317
4;2015;5;318;SI SE PUEDE;AGRUPACION DE ELECTORES SI SE PUEDE MUNICIPIO DE E;318;318;318
4;2015;5;319;AGRUPACIÓN;"AGRUPACIÓN DE ELECTORES ""SI SE PUEDE"" QUINTANA DE";319;319;319
4;2015;5;320;AGRUPACION;AGRUPACION DE ELECTORES SI SE PUEDE SEDAVI;320;320;320
4;2015;5;321;AESSPV;AGRUPACION DE ELECTORES SI SE PUEDE VILLANUEVA;321;321;321
4;2015;5;322;SIP;AGRUPACION DE ELECTORES SOCIALISTAS INDEPENDIENTES;322;322;322
4;2015;5;323;AESA;AGRUPACION DE ELECTORES SOCIALISTAS POR ALCONCHEL;323;323;323
4;2015;5;324;SOMOS AVILÉ;"Agrupación de Electores ""Somos Avilés""";324;324;324
4;2015;5;325;SOMOS CORVE;Agrupación de Electores Somos Corvera;325;325;325
4;2015;5;326;AGRUPACION;"AGRUPACION DE ELECTORES ""SOMOS NAVACONCEJO""";326;326;326
4;2015;5;327;S.V.;AGRUPACION DE ELECTORES SOMOS VECIN@S;327;327;327
4;2015;5;328;SORIAN@S;AGRUPACIÓN DE ELECTORES SORIAN@S;328;328;328
4;2015;5;329;AGRUPACION;AGRUPACION DE ELECTORES TODOS CERVERA;329;329;329
4;2015;5;330;TSF;AGRUPACIÓN DE ELECTORES TODOS SOMOS FUENSALDAÑA;330;330;330
4;2015;5;331;tod@s;AGRUPACION DE ELECTORES - tod@s-;331;331;331
4;2015;5;501;AIB;AGRUPACION INDEPENDIENTE BELASCOAIN;501;501;501
4;2015;5;502;CyS;"AGRUPACIÓN INDEPENDIENTE ""CAMBIO Y SOLUCIONES""";502;502;502
4;2015;5;504;A.I.C.C;AGRUPACION INDEPENDIENTE CENDEA DE CIZUR;504;504;504
4;2015;5;505;A.I.C.G.;AGRUPACIÓN INDEPENDIENTE CENDEA DE GALAR;505;505;505
4;2015;5;510;AGRUPACION;AGRUPACION INDEPENDIENTE DE ADIOS;510;510;510
4;2015;5;511;AIA;AGRUPACION INDEPENDIENTE DE AGUILAR;511;511;511
4;2015;5;512;A.I.A;AGRUPACIÓN INDEPENDIENTE DE ARIA;512;512;512
4;2015;5;514;AIBAILEN;AGRUPACION INDEPENDIENTE DE BAILEN;514;514;514
4;2015;5;1;15AT HAMABO;15AT HAMABOSTBAT;1;1;1
4;2015;5;2;3 EN CÍRCUL;3 3N CÍRCULO LOZOYUELA-NAVAS-SIETEGLESIAS;2;2;2
4;2015;5;3;aG;ABANT GORDEXOLA;3;3;3
4;2015;5;4;CAT-HIG;ABIERTA Y TRANSPARENTE - HAUTAGAITZA IREKI ETA GAR;4;4;4
4;2015;5;5;ABOTSANITZ;ABOTSANITZ;5;5;5
4;2015;5;7;ACCIO;ACCIÓ CIUTADANA;7;7;7
4;2015;5;8;ACIRE;ACCIÓ I RENOVACIÓ;8;8;8
4;2015;5;9;AGIN;ACCIÓ MONTSEC D'ARES;9;9;9
4;2015;5;11;AC.CE.DE;ACCIÓN CERDANÍ DEMOCRÁTICA;11;11;11
4;2015;5;12;AC-ALG;ACCIÓN CIUDADANA ALGECIRAS;12;12;12
4;2015;5;13;A.D.C.G.;ACCION DEMOCRATICA DE CENTRO DE GALICIA;13;13;13
4;2015;5;14;AS;ACCION SOCIAL;14;14;14
4;2015;5;16;ACCV;ACCIÓN VOTANTE;16;16;16
4;2015;5;30;ASña;ACTIVA SANTOÑA;30;30;30
4;2015;5;31;ACTIVEM;ACTIVEM L'ALBAGÉS;31;31;31
4;2015;5;32;ACTÜA TORRE;ACTÚA TORRENT;32;32;32
4;2015;5;33;AxCastro;ACUERDO POR CASTRO;33;33;33
4;2015;5;34;(A);ADELANTE;34;34;34
4;2015;5;35;ADELANTE-BE;ADELANTE BERIAIN-BERIAIN AURRERA;35;35;35
4;2015;5;38;ADIE;ADIE OROZKOKO TALDE INDEPENDENTEA;38;38;38
4;2015;5;39;ADNM;ADNMORVEDRE;39;39;39
4;2015;5;40;GENTCAR;A. E. GENT DE CARCAIXENT;40;40;40
4;2015;5;41;INDEPENDDIE;A.E.I.S.;41;41;41
4;2015;5;42;AE PODE;A Estrada PODE;42;42;42
4;2015;5;43;A.E.U.A.;A.E. VECINOS POR ALBENDIEGO;43;43;43
4;2015;5;44;AGORA NAVA;Agora Nava;44;44;44
4;2015;5;45;AJM;AGRUJOVEM (AGRUPACION JOVEN DE MENGABRIL);45;45;45
4;2015;5;46;AGRUPACIÓ B;AGRUPACIÓ BLANENCA D'ELECTORS BATEGA PER BLANES;46;46;46
4;2015;5;47;ACC;AGRUPACIÓ CIUTADANA DE CÁRCER;47;47;47
4;2015;5;48;Agr.Ar.;AGRUPACIO D'ARGENTONA;48;48;48
4;2015;5;49;ac;Agrupació de Costitx;49;49;49
4;2015;5;50;DEIA;AGRUPACIÓ DEIA;50;50;50
4;2015;5;51;AEA;AGRUPACIO D'ELECTORS AGORA;51;51;51
4;2015;5;52;ApB;AGRUPACIÓ D'ELECTORS ALTERNATIVA PER BOT;52;52;52
4;2015;5;53;A i S;AGRUPACIÓ D'ELECTORS ARA I SEMPRE SANTA SUSANNA;53;53;53
4;2015;5;54;COMÚ DE LLE;"AGRUPACIÓ D'ELECTORS ""COMÚ DE LLEIDA""";54;54;54
4;2015;5;55;C. i P.;AGRUPACIÓ D'ELECTORS CONVIVÈNCIA I PROGRÉS;55;55;55
4;2015;5;56;AE MM-SD;AGRUPACIÓ D'ELECTORS DE LA MORERA DE MONTSANT - SC;56;56;56
4;2015;5;57;AES;AGRUPACIÓ D'ELECTORS DE SAGÀS;57;57;57
4;2015;5;58;AEVH;AGRUPACIÓ D'ELECTORS DE VANDELLÒS I L'HOSPITALET D;58;58;58
4;2015;5;59;AEO;AGRUPACIÓ D'ELECTORS D'ODÈN;59;59;59
4;2015;5;60;EOB;AGRUPACIÓ D'ELECTORS ESQUERRA OBERTA BUNYOLA;60;60;60
4;2015;5;61;AGRUPACIÓ D;AGRUPACIÓ D'ELECTORS FEM POBLE;61;61;61
4;2015;5;62;AGRUPACIÓ D;AGRUPACIÓ D'ELECTORS FEM SITGES;62;62;62
4;2015;5;63;AEIG;AGRUPACIÓ D'ELECTORS INDEPENDENTS DE GUIXERS;63;63;63
4;2015;5;64;AGRUPACIÓ D;AGRUPACIÓ D'ELECTORS INDEPENDENTS DE LA MOLSOSA;64;64;64
4;2015;5;65;IPL;"AGRUPACIO D'ELECTORS ""INDEPENDENTS PER LLOMBAI""";65;65;65
4;2015;5;66;AEIPM;AGRUPACIÓ D'ELECTORS INDEPENDENTS PER MONTROY;66;66;66
4;2015;5;67;AEIO;AGRUPACIÓ D'ELECTORS INDEPENDENTS PER OLIUS;67;67;67
4;2015;5;68;AEIT;AGRUPACIÓ D'ELECTORS INDEPENDIENTS PER TÁRBENA;68;68;68
4;2015;5;69;JUNTS PER A;AGRUPACIÓ D'ELECTORS JUNTS PER ALARÓ;69;69;69
4;2015;5;70;Plataforma;AGRUPACIÓ D'ELECTORS PLATAFORMA CALERA;70;70;70
4;2015;5;71;SC;AGRUPACIO D'ELECTORS SOM CONSELL;71;71;71
4;2015;5;72;AGRUPACIÓ D;"AGRUPACIÓ D'ELECTORS ""SOM LLOSETA""";72;72;72
4;2015;5;73;SOM TORTOSA;AGRUPACIÓ D'ELECTORS SOM TORTOSA;73;73;73
4;2015;5;74;SOM VNG;AGRUPACIÓ D'ELECTORS SOM VNG;74;74;74
4;2015;5;75;A.E.T.F.F.!;AGRUPACIO D'ELECTORS (TORRELLES FONT DE FUTUR);75;75;75
4;2015;5;76;VOLPE;AGRUPACIÓ D'ELECTORS VOLEM PEGO;76;76;76
4;2015;5;80;AIV;AGRUPACIÓ D'INDEPENDENTS PER VALLBONA;80;80;80
4;2015;5;81;AIPN;AGRUPACIO D'INDEPENDENTS, PROGRESSISTES I NACIONAL;81;81;81
4;2015;5;83;ES;AGRUPACIÓ ELCTORS SELLA;83;83;83
4;2015;5;84;#¿NOMBRE?;AGRUPACIO ELECTORAL +BELLVEI;84;84;84
4;2015;5;85;AEIFR;"AGRUPACIÓ ELECTORS INDEPENDENTS ""FEM RIUDAURA""";85;85;85
4;2015;5;86;AES;AGRUPACIÓ ELECTORS SAVALL;86;86;86
4;2015;5;87;AIPD;AGRUPACIO INDEPENDENT DE LA POBLA DEL DUC;87;87;87
4;2015;5;88;AIPC /SYS;AGRUPACIÓ INDEPENDENT DE PORTO CRISTO Y S'ILLOTERS;88;88;88
4;2015;5;90;AITOR;AGRUPACIÓ INDEPENDENT DE TORRELLA;90;90;90
4;2015;5;91;A.I.G.U.A.;AGRUPACIO INDEPENDENT GENERAL D'URBANITZACIONS I A;91;91;91
4;2015;5;96;AMI-B;AGRUPACIÓ MUNICIPAL INDEPENDENT - BORDILS;96;96;96
4;2015;5;97;AAR;AGRUPACION ABIERTA ROBLEDO;97;97;97
4;2015;5;99;AA;AGRUPACION AIRATE;99;99;99
4;2015;5;100;A++;AGRUPACION ALTERNATIVA AZAGRESA;100;100;100
4;2015;5;101;A.A.T.;AGRUPACIÓN ALTERNATIVA POR TORRELAGUNA;101;101;101
4;2015;5;102;A.N.;AGRUPACION AMIGOS DE NAMBROCA;102;102;102
4;2015;5;105;AA;AGRUPACIÓN ARGA;105;105;105
4;2015;5;107;A.A.;AGRUPACION ARRANOMENDI;107;107;107
4;2015;5;110;AAB;AGRUPACION AYUNTAMIENTO DE BERRIOPLANO;110;110;110
4;2015;5;112;ACLS;AGRUPACION CENTRO LIBERAL POR SIRUELA;112;112;112
4;2015;5;113;A.C.L.;AGRUPACION CIDADANS DE LOBEIRA;113;113;113
4;2015;5;115;ACIPA;AGRUPACIÓN CIUDADANA INDEPENDIENTE PARA ARANJUEZ;115;115;115
4;2015;5;116;ACS;AGRUPACION CIVICA SALENSE;116;116;116
4;2015;5;119;ACORDE;AGRUPACION CORTECONCEPCION DE ELECTORES;119;119;119
4;2015;5;120;A.A.D.;AGRUPACION DE AMIGOS DE DESOJO;120;120;120
4;2015;5;121;A D B;AGRUPACION DE BATRES;121;121;121
4;2015;5;122;ACC;AGRUPACION DE CASTROVERDE DE CERRATO;122;122;122
4;2015;5;123;ACGO;AGRUPACIÓN DE CENTRISTAS GONDOMAR;123;123;123
4;2015;5;124;ACIP;AGRUPACION DE CIUDADANOS DE PAREDES;124;124;124
4;2015;5;125;aCes;AGRUPACION DE CIUDADANOS POR ELCHE DE LA SIERRA;125;125;125
4;2015;5;126;AGUILAS PUE;"AGRUPACION DE ELECTORES ""AGUILAS PUEDE""";126;126;126
4;2015;5;127;Ahora Ontíg;AGRUPACION DE ELECTORES AHORA ONTÍGOLA;127;127;127
4;2015;5;128;AHORA VQ;AGRUPACION DE ELECTORES AHORA VILLAQUILAMBRE;128;128;128
4;2015;5;129;A-E ALDEANO;AGRUPACIÓN DE ELECTORES ALDEA EN CABO;129;129;129
4;2015;5;130;ALGARROBO P;AGRUPACION DE ELECTORES ALGARROBO PUEDE;130;130;130
4;2015;5;131;AGRUPACIÓN;"AGRUPACIÓN DE ELECTORES ""ALGECIRAS, SÍ SE PUEDE""";131;131;131
4;2015;5;1265;C.I.C.;CANDIDATURA DE IZQUIERDAS DE CORTES;1265;1265;1265
4;2015;5;1273;CUP;CANDIDATURA DE UNIDAD POPULAR/TUDELA-TUTERA;1273;1273;1273
4;2015;5;1274;CUV;CANDIDATURA DE UNIDAD VECINAL;1274;1274;1274
4;2015;5;1294;CUP-PA;CANDIDATURA D'UNITAT POPULAR-POBLE ACTIU;1294;1294;1294
4;2015;5;1312;CANDIDATURA;CANDIDATURA INDEPENDIENTE;1312;1312;1312
4;2015;5;1313;C.I.;CANDIDATURA INDEPENDIENTE;1313;1313;1313
4;2015;5;1314;C.I.C.;CANDIDATURA INDEPENDIENTE CASAVEJANA;1314;1314;1314
4;2015;5;1315;CI-CCD;CANDIDATURA INDEPENDIENTE-CIUDADANOS DE CENTRO DEM;1315;1315;1315
4;2015;5;1316;CISB;Candidatura Independiente Concejo de Soto del Barc;1316;1316;1316
4;2015;5;1317;CIA;CANDIDATURA INDEPENDIENTE DE ALDEA DE SAN MIGUEL;1317;1317;1317
4;2015;5;1318;CIA;CANDIDATURA INDEPENDIENTE DE ARMUÑA;1318;1318;1318
4;2015;5;1320;C.I.B.;CANDIDATURA INDEPENDIENTE DE BUENAVISTA;1320;1320;1320
4;2015;5;1322;C.I.C.;CANDIDATURA INDEPENDIENTE DE EL CARRASCALEJO;1322;1322;1322
4;2015;5;1323;CANDIDATURA;CANDIDATURA INDEPENDIENTE DE ETAYO;1323;1323;1323
4;2015;5;1326;C.I.D.G.;CANDIDATURA INDEPENDIENTE DE LA GUIJARROSA;1326;1326;1326
4;2015;5;1327;CANDIDATURA;CANDIDATURA INDEPENDIENTE DE LEGARIA;1327;1327;1327
4;2015;5;1328;CANDIDATURA;CANDIDATURA INDEPENDIENTE DE OLEJUA;1328;1328;1328
4;2015;5;1329;CIO;CANDIDATURA INDEPENDIENTE DE OLMEDA;1329;1329;1329
4;2015;5;1330;TEO;CANDIDATURA INDEPENDIENTE DE PRADILLO;1330;1330;1330
4;2015;5;1331;CISTODOM;CANDIDATURA INDEPENDIENTE DE SANTO DOMINGO DE LAS;1331;1331;1331
4;2015;5;1332;C.I.T;CANDIDATURA INDEPENDIENTE DE TAMARIZ;1332;1332;1332
4;2015;5;1333;CITOR;CANDIDATURA INDEPENDIENTE DE TORREMONTALBO;1333;1333;1333
4;2015;5;1335;CIV;CANDIDATURA INDEPENDIENTE DE VALDEPIÉLAGOS;1335;1335;1335
4;2015;5;1336;CIV;CANDIDATURA INDEPENDIENTE DE VERTAVILLO;1336;1336;1336
4;2015;5;1337;CAI V;CANDIDATURA INDEPENDIENTE DE VILLAMEDIANA DE IREGU;1337;1337;1337
4;2015;5;1339;CANDIDATURA;CANDIDATURA INDEPENDIENTE EL PUNTAL;1339;1339;1339
4;2015;5;1340;CII;CANDIDATURA INDEPENDIENTE IRACHE;1340;1340;1340
4;2015;5;1341;CANDIDATURA;CANDIDATURA INDEPENDIENTE LARRAUNGO ELKARTEA;1341;1341;1341
4;2015;5;1342;C.I.CL.;CANDIDATURA INDEPENDIENTE POR CLAVIJO;1342;1342;1342
4;2015;5;1343;C.I.P.C.;CANDIDATURA INDEPENDIENTE POR CUBILLOS;1343;1343;1343
4;2015;5;1344;C.I.SAN PED;CANDIDATURA INDEPENDIENTE SAN PEDRO DEL ARROYO;1344;1344;1344
4;2015;5;1345;CIVE;CANDIDATURA INDEPENDIENTE VECINAL;1345;1345;1345
4;2015;5;1347;C.L.I.;CANDIDATURA LOCAL INDEPENDIENTE;1347;1347;1347
4;2015;5;1348;CANDIDATURA;CANDIDATURA MUSKILDA;1348;1348;1348
4;2015;5;1349;CANDIDATURA;CANDIDATURA OTSAGABIA;1349;1349;1349
4;2015;5;1352;CPVA;CANDIDATURA POPULAR DEL VALLE DE ARANGUREN;1352;1352;1352
4;2015;5;1353;C.P.IRANZU;CANDIDATURA POPULAR IRANZU HERRI KANDIDATURA;1353;1353;1353
4;2015;5;1354;CV;CANDIDATURA POR VALLEJERA;1354;1354;1354
4;2015;5;1355;CPV;CANDIDATURA POR VILLAVIEJA;1355;1355;1355
4;2015;5;1356;C.P.I.C.;CANDIDATURA PROGRESISTA INDEPENDIENTE DE CARTAMA;1356;1356;1356
4;2015;5;333;TRABAJEMOS;AGRUPACION DE ELECTORES TRABAJEMOS;333;333;333
4;2015;5;334;TRABUCO SI;AGRUPACION DE ELECTORES TRABUCO SOLUCION INDEPENDI;334;334;334
4;2015;5;335;UPA;AGRUPACIÓN DE ELECTORES UNIDOS POR ALMADÉN;335;335;335
4;2015;5;336;A.E.U.C.;AGRUPACION DE ELECTORES UNIDOS POR EL CAMBIO;336;336;336
4;2015;5;337;UPM;"AGRUPACION DE ELECTORES ""UNIDOS POR MONTAMARTA""";337;337;337
4;2015;5;338;USC;AGRUPACION DE ELECTORES UNIDOS POR SANTA COLOMBA;338;338;338
4;2015;5;339;UNP;AGRUPACION DE ELECTORES UNION NUEVA PATERNA;339;339;339
4;2015;5;340;U.P;AGRUPACION DE ELECTORES UNION POR PENAGOS;340;340;340
4;2015;5;342;VAMOS;AGRUPACION DE ELECTORES VAMOS UNION CIUDADANA;342;342;342
4;2015;5;343;veciñanza;AGRUPACION DE ELECTORES VECIÑANZA;343;343;343
4;2015;5;344;VECINOS;AGRUPACION DE ELECTORES VECINOS;344;344;344
4;2015;5;345;AEVE;AGRUPACION DE ELECTORES VECINOS DE ESCACENA;345;345;345
4;2015;5;346;VM;AGRUPACIÓN DE ELECTORES VECINOS DE MENA;346;346;346
4;2015;5;347;VSB;AGRUPACION DE ELECTORES VECINOS DE SAN BARTOLOME;347;347;347
4;2015;5;348;A.V.I.;Agrupación de Electores Vecinos Implicados;348;348;348
4;2015;5;349;VIP;Agrupación de Electores Vecinos Independientes por;349;349;349
4;2015;5;350;VECINOS;AGRUPACIÓN DE ELECTORES VECINOS POR ARGAMASILLA;350;350;350
4;2015;5;351;AGRUPACIÓN;AGRUPACIÓN DE ELECTORES VECINOS POR BULLAS;351;351;351
4;2015;5;352;VC;AGRUPACION DE ELECTORES VECINOS POR CARRANQUE;352;352;352
4;2015;5;353;AEVEA;AGRUPACION DE ELECTORES VECINOS POR EL ATAZAR;353;353;353
4;2015;5;354;VxV;AGRUPACION DE ELECTORES VECINOS POR EL VALLE;354;354;354
4;2015;5;355;VpM;Agrupación de Electores VECINOS POR MACOTERA;355;355;355
4;2015;5;356;VPT;AGRUPACION DE ELECTORES VECINOS POR TRASPINEDO;356;356;356
4;2015;5;357;VECIÑ@S;AGRUPACIÓN DE ELECTORES VECIÑ@S DE BOQUEIXÓN;357;357;357
4;2015;5;358;VXV;AGRUPACION DE ELECTORES VEÏNS PER VINALESA;358;358;358
4;2015;5;359;AGRUPACION;AGRUPACION DE ELECTORES VELILLA;359;359;359
4;2015;5;360;VJP;AGRUPACION DE ELECTORES VILAMARXANT JUNTS PODREM;360;360;360
4;2015;5;361;VSEC;"AGRUPACIÓN DE ELECTORES ""VILA-SECA EN COMÚ""";361;361;361
4;2015;5;362;VILLA DE CO;AGRUPACION DE ELECTORES VILLA DE COCA;362;362;362
4;2015;5;363;V.C.I;AGRUPACION DE ELECTORES VILLAMENA CANDIDATURA INDE;363;363;363
4;2015;5;364;AGRUPACION;"AGRUPACION DE ELECTORES ""VOZ DEL VALLE""";364;364;364
4;2015;5;365;AEYAVZ;AGRUPACIÓN DE ELECTORES Y AMIGOS DEL VALLE DE ZAMA;365;365;365
4;2015;5;366;VPC;AGRUPACION DE ELECTROES VECINOS POR CALALBERCHE;366;366;366
4;2015;5;368;ADEM;AGRUPACION DEMOCRATICA DE ELECTORES DE MANCHA REAL;368;368;368
4;2015;5;369;ADS;AGRUPACION DEMOCRATICA DE SETILES;369;369;369
4;2015;5;370;ADIA;AGRUPACION DEMOCRATICA INDEPENDIENTE ANDALUCIA;370;370;370
4;2015;5;371;SOMOS A.S.I;AGRUPACIÓN DE SANTAELLANOS INDEPENDIENTES;371;371;371
4;2015;5;372;AGRUP.TORRE;AGRUPACION DE TORREQUEMADA;372;372;372
4;2015;5;373;A.D.V.;AGRUPACION DE VECINOS;373;373;373
4;2015;5;374;AVA;AGRUPACIÓN DE VECINOS DE ALDEASEÑOR;374;374;374
4;2015;5;375;A.D.V.I.;AGRUPACION DE VECINOS INDEPENDIENTE DE SANTA CRUZ;375;375;375
4;2015;5;376;AVIG;AGRUPACION DE VECINOS INDEPENDIENTES DE GELIDA;376;376;376
4;2015;5;377;VCM;AGRUPACION DE VECINOS POR EL CASAR Y MESONES;377;377;377
4;2015;5;378;AVVS;AGRUPACION DE VECINOS VALLE DE SEDANO;378;378;378
4;2015;5;379;A.V.I.;AGRUPACION DE VEIGUESES INDEPENDIENTES;379;379;379
4;2015;5;380;I. x DUBRA;AGRUPACION DUBRESA INDEPENDIENTE;380;380;380
4;2015;5;382;AEA;AGRUPACION ELECTORAL ALDAPETAS;382;382;382
4;2015;5;383;AEA;AGRUPACION ELECTORAL ALDASUR;383;383;383
4;2015;5;384;A.E.A.;AGRUPACIÓN ELECTORAL ARANARACHE;384;384;384
4;2015;5;386;AZKAR;AGRUPACION ELECTORAL AZKAR;386;386;386
4;2015;5;389;AGRUPACION;AGRUPACION ELECTORAL BIURRUN-OLKOTZ;389;389;389
4;2015;5;391;AEAO;AGRUPACION ELECTORAL DE ARROYO DEL OJANCO;391;391;391
4;2015;5;392;A.G.I.Z.I.A;AGRUPACION ELECTORAL DE IZQUIERDA INDEPENDIENTE DE;392;392;392
4;2015;5;393;A.E.O.;AGRUPACION ELECTORAL DE ORBARA;393;393;393
4;2015;5;395;AEDVH;AGRUPACION ELECTORAL DE VECINOS DE HERENCIA;395;395;395
4;2015;5;396;A.E.V.I.;AGRUPACION ELECTORAL DE VILLANUEVA DEL RIO;396;396;396
4;2015;5;398;AE EL FRAGO;AGRUPACION ELECTORAL EL FRAGO;398;398;398
4;2015;5;401;AGRUPACION;AGRUPACION ELECTORAL ERRENIEGA;401;401;401
4;2015;5;402;A.E.E.;AGRUPACION ELECTORAL ERRIBURUA;402;402;402
4;2015;5;403;A.E.E.;AGRUPACION ELECTORAL EULATE;403;403;403
4;2015;5;404;F-V-;AGRUPACION ELECTORAL FUENTES DE VALDEPERO;404;404;404
4;2015;5;405;GA;AGRUPACION ELECTORAL GANAR ALBOLOTE;405;405;405
4;2015;5;406;AEGE;AGRUPACION ELECTORAL GARES ENTRETODOS;406;406;406
4;2015;5;408;AEI;AGRUPACION ELECTORAL INDEPENDIENTE;408;408;408
4;2015;5;409;A.E.I.;AGRUPACIÓN ELECTORAL INDEPENDIENTE;409;409;409
4;2015;5;332;TU;AGRUPACION DE ELECTORES TORREJON UNIDO;332;332;332
4;2015;5;410;A.E.I.C.T.;AGRUPACION ELECTORAL INDEPENDIENTE CONDADO DE TREV;410;410;410
4;2015;5;411;A.E.I.A;AGRUPACION ELECTORAL INDEPENDIENTE DE ANGUCIANA;411;411;411
4;2015;5;413;A.E.I.L.;AGRUPACION ELECTORAL INDEPENDIENTE DE LEACHE;413;413;413
4;2015;5;415;AEIDV;AGRUPACION ELECTORAL INDEPENDIENTE DE VILLARMAYOR;415;415;415
4;2015;5;416;AGELINVI;AGRUPACION ELECTORAL INDEPENDIENTE DE VILLERIAS DE;416;416;416
4;2015;5;417;A.E.I.L.P.M;AGRUPACIÓN ELECTORAL INDEPENDIENTE LAS PALOMAS DE;417;417;417
4;2015;5;418;A.E.I.L.;AGRUPACION ELECTORAL INDEPENDIENTE LEGARDA;418;418;418
4;2015;5;419;A.G.E.I.S.M;AGRUPACIÓN ELECTORAL INDEPENDIENTE SAN MARTÍN DE R;419;419;419
4;2015;5;421;A.E.I.S;AGRUPACION ELECTORAL INDEPENDIENTE SANTA CRIZ;421;421;421
4;2015;5;422;A.E.I.M;AGRUPACION ELECTORAL INDEPENDIENTES DE MELIDA;422;422;422
4;2015;5;423;IPLTV;AGRUPACION ELECTORAL INDEPENDIENTES POR LAS TRES V;423;423;423
4;2015;5;424;AEISSG;AGRUPACION ELECTORAL INDEPENDIENTES Y SIMPATIZANTE;424;424;424
4;2015;5;425;AEIUB;AGRUPACION ELECTORAL INDEPENDIENTE URRAUL BAJO;425;425;425
4;2015;5;426;AEIVA;AGRUPACION ELECTORAL INDEPENDIENTE VIRGEN DE ARBUR;426;426;426
4;2015;5;427;VVR;AGRUPACION ELECTORAL INDEPENDIENTE V.V.R;427;427;427
4;2015;5;429;AEJ;AGRUPACIÓN ELECTORAL JUNTAS;429;429;429
4;2015;5;430;A.E.K.15;AGRUPACIÓN ELECTORAL KOSTALERA 2015;430;430;430
4;2015;5;431;A.E.L.;AGRUPACION ELECTORAL LEZARANA;431;431;431
4;2015;5;432;A.E.L.H.A.;AGRUPACION ELECTORAL LOS HUERTOS DE ALFAJARIN;432;432;432
4;2015;5;433;AEM;AGRUPACIÓN ELECTORAL MAÑERU;433;433;433
4;2015;5;434;AGRUPACION;AGRUPACION ELECTORAL MIRALDEA - MANTXOLA;434;434;434
4;2015;5;439;AEP;AGRUPACION ELECTORAL PEÑAFLOR;439;439;439
4;2015;5;440;AGRUPACION;AGRUPACION ELECTORAL PLAZAOLA;440;440;440
4;2015;5;441;AEPY;AGRUPACION ELECTORAL POR YATOVA;441;441;441
4;2015;5;442;AGRUPACION;AGRUPACION ELECTORAL PUENTESINA;442;442;442
4;2015;5;446;AERBI;AGRUPACIÓN ELECTORAL RIBERA BAJA INDEPENDIENTE;446;446;446
4;2015;5;449;AESPM;AGRUPACION ELECTORAL SAN PEDRO MARTIR;449;449;449
4;2015;5;450;AGRUPACION;AGRUPACION ELECTORAL SAN PEDRO MELGAR;450;450;450
4;2015;5;452;AGRUPACION;AGRUPACION ELECTORAL TXANTXALAN;452;452;452
4;2015;5;454;UPSC-KHBS;AGRUPACION ELECTORAL UNIDAD POPULAR SOCIALISTA CAS;454;454;454
4;2015;5;455;UNIDOS POR;AGRUPACIÓN ELECTORAL UNIDOS POR ARAFO;455;455;455
